1_tuning_pipeline/tuning_logs/database_tuning_record.json
[0,[[[["GetBlock",[],["matmul","main"],["b0"]],["GetBlock",[],["T_add","main"],["b1"]],["GetBlock",[],["root","main"],["b2"]],["Annotate",["b0","\"SSSRRSRS\""],["meta_schedule.tiling_structure"],[]],["GetLoops",["b0"],[],["l3","l4","l5"]],["SamplePerfectTile",["l3"],[5,64],["v6","v7","v8","v9","v10"]],["Split",["l3","v6","v7","v8","v9","v10"],[1,0],["l11","l12","l13","l14","l15"]],["SamplePerfectTile",["l4"],[5,64],["v16","v17","v18","v19","v20"]],["Split",["l4","v16","v17","v18","v19","v20"],[1,0],["l21","l22","l23","l24","l25"]],["SamplePerfectTile",["l5"],[3,64],["v26","v27","v28"]],["Split",["l5","v26","v27","v28"],[1,0],["l29","l30","l31"]],["Reorder",["l11","l21","l12","l22","l13","l23","l29","l30","l14","l24","l31","l15","l25"],[],[]],["Fuse",["l11","l21"],[1],["l32"]],["Bind",["l32"],["blockIdx.x"],[]],["Fuse",["l12","l22"],[1],["l33"]],["Bind",["l33"],["vthread.x"],[]],["Fuse",["l13","l23"],[1],["l34"]],["Bind",["l34"],["threadIdx.x"],[]],["Annotate",["b0",32],["meta_schedule.thread_extent_low_inclusive"],[]],["Annotate",["b0",1024],["meta_schedule.thread_extent_high_inclusive"],[]],["CacheWrite",["b0",[]],[0,"local"],["b35"]],["ReverseComputeAt",["b35","l34"],[1,-1],[]],["CacheRead",["b0",["b0"]],[0,"shared"],["b36"]],["ComputeAt",["b36","l29"],[1,-1],[]],["GetLoops",["b36"],[],["l37","l38","l39","l40","l41","l42"]],["Fuse",["l41","l42"],[1],["l43"]],["SampleCategorical",[],[[1,2,3,4],[0.25,0.25,0.25,0.25]],["v44"]],["Annotate",["b36","v44"],["meta_schedule.cooperative_fetch"],[]],["CacheRead",["b0",["b0"]],[1,"shared"],["b45"]],["ComputeAt",["b45","l29"],[1,-1],[]],["GetLoops",["b45"],[],["l46","l47","l48","l49","l50","l51"]],["Fuse",["l50","l51"],[1],["l52"]],["SampleCategorical",[],[[1,2,3,4],[0.25,0.25,0.25,0.25]],["v53"]],["Annotate",["b45","v53"],["meta_schedule.cooperative_fetch"],[]],["ReverseComputeInline",["b1"],[],[]],["SampleCategorical",[],[[0,16,64,512,1024],[0.2000000000000000111,0.2000000000000000111,0.2000000000000000111,0.2000000000000000111,0.2000000000000000111]],["v54"]],["Annotate",["b2","v54"],["meta_schedule.unroll_explicit"],[]],["EnterPostproc",[],[],[]],["Unannotate",["b36"],["meta_schedule.cooperative_fetch"],[]],["GetLoops",["b36"],[],["l55","l56","l57","l58","l59"]],["Split",["l59","None",100],[1,0],["l60","l61"]],["Bind",["l61"],["threadIdx.x"],[]],["Unannotate",["b45"],["meta_schedule.cooperative_fetch"],[]],["GetLoops",["b45"],[],["l62","l63","l64","l65","l66"]],["Split",["l66","None",100],[1,0],["l67","l68"]],["Bind",["l68"],["threadIdx.x"],[]],["GetBlock",[],["root","main"],["b69"]],["Unannotate",["b69"],["meta_schedule.unroll_explicit"],[]],["GetChildBlocks",["b69"],[],["b70","b71","b72","b73"]],["GetLoops",["b70"],[],["l74","l75","l76","l77","l78","l79"]],["GetLoops",["b71"],[],["l80","l81","l82","l83","l84","l85"]],["GetLoops",["b72"],[],["l86","l87","l88","l89","l90","l91","l92","l93","l94","l95"]],["Annotate",["l86",1024],["pragma_auto_unroll_max_step"],[]],["Annotate",["l86",1],["pragma_unroll_explicit"],[]],["GetLoops",["b73"],[],["l96","l97","l98","l99","l100"]],["GetBlock",[],["matmul","main"],["b101"]],["GetLoops",["b101"],[],["l102","l103","l104","l105","l106","l107","l108","l109","l110","l111"]],["DecomposeReduction",["b101","l105"],[],["b112"]]],[[5,[1,1,1,1,1]],[7,[1,5,100,1,2]],[9,[128,1,4]],[26,2],[32,0],[35,4]]],[0.0001012178294884653857],{"arch":"sm_86","keys":["cuda","gpu"],"kind":"cuda","max_num_threads":1024,"max_shared_memory_per_block":49152,"max_threads_per_block":1024,"registers_per_block":65536,"tag":"","thread_warp_size":32},[["TENSOR","float32",[1,512]],["TENSOR","float32",[512,1000]],["TENSOR","float32",[1000]],["TENSOR","float32",[1,1000]]]]]
[0,[[[["GetBlock",[],["matmul","main"],["b0"]],["GetBlock",[],["T_add","main"],["b1"]],["GetBlock",[],["root","main"],["b2"]],["Annotate",["b0","\"SSSRRSRS\""],["meta_schedule.tiling_structure"],[]],["GetLoops",["b0"],[],["l3","l4","l5"]],["SamplePerfectTile",["l3"],[5,64],["v6","v7","v8","v9","v10"]],["Split",["l3","v6","v7","v8","v9","v10"],[1,0],["l11","l12","l13","l14","l15"]],["SamplePerfectTile",["l4"],[5,64],["v16","v17","v18","v19","v20"]],["Split",["l4","v16","v17","v18","v19","v20"],[1,0],["l21","l22","l23","l24","l25"]],["SamplePerfectTile",["l5"],[3,64],["v26","v27","v28"]],["Split",["l5","v26","v27","v28"],[1,0],["l29","l30","l31"]],["Reorder",["l11","l21","l12","l22","l13","l23","l29","l30","l14","l24","l31","l15","l25"],[],[]],["Fuse",["l11","l21"],[1],["l32"]],["Bind",["l32"],["blockIdx.x"],[]],["Fuse",["l12","l22"],[1],["l33"]],["Bind",["l33"],["vthread.x"],[]],["Fuse",["l13","l23"],[1],["l34"]],["Bind",["l34"],["threadIdx.x"],[]],["Annotate",["b0",32],["meta_schedule.thread_extent_low_inclusive"],[]],["Annotate",["b0",1024],["meta_schedule.thread_extent_high_inclusive"],[]],["CacheWrite",["b0",[]],[0,"local"],["b35"]],["ReverseComputeAt",["b35","l34"],[1,-1],[]],["CacheRead",["b0",["b0"]],[0,"shared"],["b36"]],["ComputeAt",["b36","l29"],[1,-1],[]],["GetLoops",["b36"],[],["l37","l38","l39","l40","l41","l42"]],["Fuse",["l41","l42"],[1],["l43"]],["SampleCategorical",[],[[1,2,3,4],[0.25,0.25,0.25,0.25]],["v44"]],["Annotate",["b36","v44"],["meta_schedule.cooperative_fetch"],[]],["CacheRead",["b0",["b0"]],[1,"shared"],["b45"]],["ComputeAt",["b45","l29"],[1,-1],[]],["GetLoops",["b45"],[],["l46","l47","l48","l49","l50","l51"]],["Fuse",["l50","l51"],[1],["l52"]],["SampleCategorical",[],[[1,2,3,4],[0.25,0.25,0.25,0.25]],["v53"]],["Annotate",["b45","v53"],["meta_schedule.cooperative_fetch"],[]],["Fuse",["l29"],[1],["l54"]],["Annotate",["l54",[0,0,2]],["software_pipeline_stage"],[]],["Annotate",["l54",[0,1,2]],["software_pipeline_order"],[]],["Annotate",["l54",[0]],["software_pipeline_async_stages"],[]],["ReverseComputeInline",["b1"],[],[]],["SampleCategorical",[],[[0,16,64,512,1024],[0.2000000000000000111,0.2000000000000000111,0.2000000000000000111,0.2000000000000000111,0.2000000000000000111]],["v55"]],["Annotate",["b2","v55"],["meta_schedule.unroll_explicit"],[]],["EnterPostproc",[],[],[]],["Unannotate",["b36"],["meta_schedule.cooperative_fetch"],[]],["GetLoops",["b36"],[],["l56","l57","l58","l59","l60"]],["Split",["l60","None",100,2],[1,0],["l61","l62","l63"]],["Vectorize",["l63"],[],[]],["Bind",["l62"],["threadIdx.x"],[]],["Unannotate",["b45"],["meta_schedule.cooperative_fetch"],[]],["GetLoops",["b45"],[],["l64","l65","l66","l67","l68"]],["Split",["l68","None",100],[1,0],["l69","l70"]],["Bind",["l70"],["threadIdx.x"],[]],["GetBlock",[],["root","main"],["b71"]],["Unannotate",["b71"],["meta_schedule.unroll_explicit"],[]],["GetChildBlocks",["b71"],[],["b72","b73","b74","b75"]],["GetLoops",["b72"],[],["l76","l77","l78","l79","l80","l81","l82"]],["GetLoops",["b73"],[],["l83","l84","l85","l86","l87","l88"]],["GetLoops",["b74"],[],["l89","l90","l91","l92","l93","l94","l95","l96","l97","l98"]],["Annotate",["l89",64],["pragma_auto_unroll_max_step"],[]],["Annotate",["l89",1],["pragma_unroll_explicit"],[]],["GetLoops",["b75"],[],["l99","l100","l101","l102","l103"]],["GetBlock",[],["matmul","main"],["b104"]],["GetLoops",["b104"],[],["l105","l106","l107","l108","l109","l110","l111","l112","l113","l114"]],["DecomposeReduction",["b104","l108"],[],["b115"]]],[[5,[1,1,1,1,1]],[7,[10,1,100,1,1]],[9,[16,2,16]],[26,1],[32,2],[39,2]]],[1.3248180245204667591e-05],{"arch":"sm_86","keys":["cuda","gpu"],"kind":"cuda","max_num_threads":1024,"max_shared_memory_per_block":49152,"max_threads_per_block":1024,"registers_per_block":65536,"tag":"","thread_warp_size":32},[["TENSOR","float32",[1,512]],["TENSOR","float32",[512,1000]],["TENSOR","float32",[1000]],["TENSOR","float32",[1,1000]]]]]
[0,[[[["GetBlock",[],["matmul","main"],["b0"]],["GetBlock",[],["T_add","main"],["b1"]],["GetBlock",[],["root","main"],["b2"]],["Annotate",["b0","\"SSSRRSRS\""],["meta_schedule.tiling_structure"],[]],["GetLoops",["b0"],[],["l3","l4","l5"]],["SamplePerfectTile",["l3"],[5,64],["v6","v7","v8","v9","v10"]],["Split",["l3","v6","v7","v8","v9","v10"],[1,0],["l11","l12","l13","l14","l15"]],["SamplePerfectTile",["l4"],[5,64],["v16","v17","v18","v19","v20"]],["Split",["l4","v16","v17","v18","v19","v20"],[1,0],["l21","l22","l23","l24","l25"]],["SamplePerfectTile",["l5"],[3,64],["v26","v27","v28"]],["Split",["l5","v26","v27","v28"],[1,0],["l29","l30","l31"]],["Reorder",["l11","l21","l12","l22","l13","l23","l29","l30","l14","l24","l31","l15","l25"],[],[]],["Fuse",["l11","l21"],[1],["l32"]],["Bind",["l32"],["blockIdx.x"],[]],["Fuse",["l12","l22"],[1],["l33"]],["Bind",["l33"],["vthread.x"],[]],["Fuse",["l13","l23"],[1],["l34"]],["Bind",["l34"],["threadIdx.x"],[]],["Annotate",["b0",32],["meta_schedule.thread_extent_low_inclusive"],[]],["Annotate",["b0",1024],["meta_schedule.thread_extent_high_inclusive"],[]],["CacheWrite",["b0",[]],[0,"local"],["b35"]],["ReverseComputeAt",["b35","l34"],[1,-1],[]],["CacheRead",["b0",["b0"]],[0,"shared"],["b36"]],["ComputeAt",["b36","l29"],[1,-1],[]],["GetLoops",["b36"],[],["l37","l38","l39","l40","l41","l42"]],["Fuse",["l41","l42"],[1],["l43"]],["SampleCategorical",[],[[1,2,3,4],[0.25,0.25,0.25,0.25]],["v44"]],["Annotate",["b36","v44"],["meta_schedule.cooperative_fetch"],[]],["CacheRead",["b0",["b0"]],[1,"shared"],["b45"]],["ComputeAt",["b45","l29"],[1,-1],[]],["GetLoops",["b45"],[],["l46","l47","l48","l49","l50","l51"]],["Fuse",["l50","l51"],[1],["l52"]],["SampleCategorical",[],[[1,2,3,4],[0.25,0.25,0.25,0.25]],["v53"]],["Annotate",["b45","v53"],["meta_schedule.cooperative_fetch"],[]],["Fuse",["l29"],[1],["l54"]],["Annotate",["l54",[0,0,2]],["software_pipeline_stage"],[]],["Annotate",["l54",[0,1,2]],["software_pipeline_order"],[]],["Annotate",["l54",[0]],["software_pipeline_async_stages"],[]],["ReverseComputeInline",["b1"],[],[]],["SampleCategorical",[],[[0,16,64,512,1024],[0.2000000000000000111,0.2000000000000000111,0.2000000000000000111,0.2000000000000000111,0.2000000000000000111]],["v55"]],["Annotate",["b2","v55"],["meta_schedule.unroll_explicit"],[]],["EnterPostproc",[],[],[]],["Unannotate",["b36"],["meta_schedule.cooperative_fetch"],[]],["GetLoops",["b36"],[],["l56","l57","l58","l59","l60"]],["Split",["l60","None",40,4],[1,0],["l61","l62","l63"]],["Vectorize",["l63"],[],[]],["Bind",["l62"],["threadIdx.x"],[]],["Unannotate",["b45"],["meta_schedule.cooperative_fetch"],[]],["GetLoops",["b45"],[],["l64","l65","l66","l67","l68"]],["Split",["l68","None",40,4],[1,0],["l69","l70","l71"]],["Vectorize",["l71"],[],[]],["Bind",["l70"],["threadIdx.x"],[]],["GetBlock",[],["root","main"],["b72"]],["Unannotate",["b72"],["meta_schedule.unroll_explicit"],[]],["GetChildBlocks",["b72"],[],["b73","b74","b75","b76"]],["GetLoops",["b73"],[],["l77","l78","l79","l80","l81","l82","l83"]],["GetLoops",["b74"],[],["l84","l85","l86","l87","l88","l89","l90"]],["GetLoops",["b75"],[],["l91","l92","l93","l94","l95","l96","l97","l98","l99","l100"]],["Annotate",["l91",1024],["pragma_auto_unroll_max_step"],[]],["Annotate",["l91",1],["pragma_unroll_explicit"],[]],["GetLoops",["b76"],[],["l101","l102","l103","l104","l105"]],["GetBlock",[],["matmul","main"],["b106"]],["GetLoops",["b106"],[],["l107","l108","l109","l110","l111","l112","l113","l114","l115","l116"]],["DecomposeReduction",["b106","l110"],[],["b117"]]],[[5,[1,1,1,1,1]],[7,[25,1,40,1,1]],[9,[8,32,2]],[26,3],[32,3],[39,4]]],[5.7089027165284873537e-06],{"arch":"sm_86","keys":["cuda","gpu"],"kind":"cuda","max_num_threads":1024,"max_shared_memory_per_block":49152,"max_threads_per_block":1024,"registers_per_block":65536,"tag":"","thread_warp_size":32},[["TENSOR","float32",[1,512]],["TENSOR","float32",[512,1000]],["TENSOR","float32",[1000]],["TENSOR","float32",[1,1000]]]]]
[0,[[[["GetBlock",[],["matmul","main"],["b0"]],["GetBlock",[],["T_add","main"],["b1"]],["GetBlock",[],["root","main"],["b2"]],["Annotate",["b0","\"SSSRRSRS\""],["meta_schedule.tiling_structure"],[]],["GetLoops",["b0"],[],["l3","l4","l5"]],["SamplePerfectTile",["l3"],[5,64],["v6","v7","v8","v9","v10"]],["Split",["l3","v6","v7","v8","v9","v10"],[1,0],["l11","l12","l13","l14","l15"]],["SamplePerfectTile",["l4"],[5,64],["v16","v17","v18","v19","v20"]],["Split",["l4","v16","v17","v18","v19","v20"],[1,0],["l21","l22","l23","l24","l25"]],["SamplePerfectTile",["l5"],[3,64],["v26","v27","v28"]],["Split",["l5","v26","v27","v28"],[1,0],["l29","l30","l31"]],["Reorder",["l11","l21","l12","l22","l13","l23","l29","l30","l14","l24","l31","l15","l25"],[],[]],["Fuse",["l11","l21"],[1],["l32"]],["Bind",["l32"],["blockIdx.x"],[]],["Fuse",["l12","l22"],[1],["l33"]],["Bind",["l33"],["vthread.x"],[]],["Fuse",["l13","l23"],[1],["l34"]],["Bind",["l34"],["threadIdx.x"],[]],["Annotate",["b0",32],["meta_schedule.thread_extent_low_inclusive"],[]],["Annotate",["b0",1024],["meta_schedule.thread_extent_high_inclusive"],[]],["CacheWrite",["b0",[]],[0,"local"],["b35"]],["ReverseComputeAt",["b35","l34"],[1,-1],[]],["CacheRead",["b0",["b0"]],[0,"shared"],["b36"]],["ComputeAt",["b36","l29"],[1,-1],[]],["GetLoops",["b36"],[],["l37","l38","l39","l40","l41","l42"]],["Fuse",["l41","l42"],[1],["l43"]],["SampleCategorical",[],[[1,2,3,4],[0.25,0.25,0.25,0.25]],["v44"]],["Annotate",["b36","v44"],["meta_schedule.cooperative_fetch"],[]],["CacheRead",["b0",["b0"]],[1,"shared"],["b45"]],["ComputeAt",["b45","l29"],[1,-1],[]],["GetLoops",["b45"],[],["l46","l47","l48","l49","l50","l51"]],["Fuse",["l50","l51"],[1],["l52"]],["SampleCategorical",[],[[1,2,3,4],[0.25,0.25,0.25,0.25]],["v53"]],["Annotate",["b45","v53"],["meta_schedule.cooperative_fetch"],[]],["ReverseComputeInline",["b1"],[],[]],["SampleCategorical",[],[[0,16,64,512,1024],[0.2000000000000000111,0.2000000000000000111,0.2000000000000000111,0.2000000000000000111,0.2000000000000000111]],["v54"]],["Annotate",["b2","v54"],["meta_schedule.unroll_explicit"],[]],["EnterPostproc",[],[],[]],["Unannotate",["b36"],["meta_schedule.cooperative_fetch"],[]],["GetLoops",["b36"],[],["l55","l56","l57","l58","l59"]],["Split",["l59","None",100],[1,0],["l60","l61"]],["Bind",["l61"],["threadIdx.x"],[]],["Unannotate",["b45"],["meta_schedule.cooperative_fetch"],[]],["GetLoops",["b45"],[],["l62","l63","l64","l65","l66"]],["Split",["l66","None",100,2],[1,0],["l67","l68","l69"]],["Vectorize",["l69"],[],[]],["Bind",["l68"],["threadIdx.x"],[]],["GetBlock",[],["root","main"],["b70"]],["Unannotate",["b70"],["meta_schedule.unroll_explicit"],[]],["GetChildBlocks",["b70"],[],["b71","b72","b73","b74"]],["GetLoops",["b71"],[],["l75","l76","l77","l78","l79","l80"]],["GetLoops",["b72"],[],["l81","l82","l83","l84","l85","l86","l87"]],["GetLoops",["b73"],[],["l88","l89","l90","l91","l92","l93","l94","l95","l96","l97"]],["Annotate",["l88",512],["pragma_auto_unroll_max_step"],[]],["Annotate",["l88",1],["pragma_unroll_explicit"],[]],["GetLoops",["b74"],[],["l98","l99","l100","l101","l102"]],["GetBlock",[],["matmul","main"],["b103"]],["GetLoops",["b103"],[],["l104","l105","l106","l107","l108","l109","l110","l111","l112","l113"]],["DecomposeReduction",["b103","l107"],[],["b114"]]],[[5,[1,1,1,1,1]],[7,[1,1,100,10,1]],[9,[256,1,2]],[26,0],[32,1],[35,3]]],[9.9473722168441422041e-05],{"arch":"sm_86","keys":["cuda","gpu"],"kind":"cuda","max_num_threads":1024,"max_shared_memory_per_block":49152,"max_threads_per_block":1024,"registers_per_block":65536,"tag":"","thread_warp_size":32},[["TENSOR","float32",[1,512]],["TENSOR","float32",[512,1000]],["TENSOR","float32",[1000]],["TENSOR","float32",[1,1000]]]]]
[0,[[[["GetBlock",[],["matmul","main"],["b0"]],["GetBlock",[],["T_add","main"],["b1"]],["GetBlock",[],["root","main"],["b2"]],["Annotate",["b0","\"SSSRRSRS\""],["meta_schedule.tiling_structure"],[]],["GetLoops",["b0"],[],["l3","l4","l5"]],["SamplePerfectTile",["l3"],[5,64],["v6","v7","v8","v9","v10"]],["Split",["l3","v6","v7","v8","v9","v10"],[1,0],["l11","l12","l13","l14","l15"]],["SamplePerfectTile",["l4"],[5,64],["v16","v17","v18","v19","v20"]],["Split",["l4","v16","v17","v18","v19","v20"],[1,0],["l21","l22","l23","l24","l25"]],["SamplePerfectTile",["l5"],[3,64],["v26","v27","v28"]],["Split",["l5","v26","v27","v28"],[1,0],["l29","l30","l31"]],["Reorder",["l11","l21","l12","l22","l13","l23","l29","l30","l14","l24","l31","l15","l25"],[],[]],["Fuse",["l11","l21"],[1],["l32"]],["Bind",["l32"],["blockIdx.x"],[]],["Fuse",["l12","l22"],[1],["l33"]],["Bind",["l33"],["vthread.x"],[]],["Fuse",["l13","l23"],[1],["l34"]],["Bind",["l34"],["threadIdx.x"],[]],["Annotate",["b0",32],["meta_schedule.thread_extent_low_inclusive"],[]],["Annotate",["b0",1024],["meta_schedule.thread_extent_high_inclusive"],[]],["CacheWrite",["b0",[]],[0,"local"],["b35"]],["ReverseComputeAt",["b35","l34"],[1,-1],[]],["CacheRead",["b0",["b0"]],[0,"shared"],["b36"]],["ComputeAt",["b36","l29"],[1,-1],[]],["GetLoops",["b36"],[],["l37","l38","l39","l40","l41","l42"]],["Fuse",["l41","l42"],[1],["l43"]],["SampleCategorical",[],[[1,2,3,4],[0.25,0.25,0.25,0.25]],["v44"]],["Annotate",["b36","v44"],["meta_schedule.cooperative_fetch"],[]],["CacheRead",["b0",["b0"]],[1,"shared"],["b45"]],["ComputeAt",["b45","l29"],[1,-1],[]],["GetLoops",["b45"],[],["l46","l47","l48","l49","l50","l51"]],["Fuse",["l50","l51"],[1],["l52"]],["SampleCategorical",[],[[1,2,3,4],[0.25,0.25,0.25,0.25]],["v53"]],["Annotate",["b45","v53"],["meta_schedule.cooperative_fetch"],[]],["ReverseComputeInline",["b1"],[],[]],["SampleCategorical",[],[[0,16,64,512,1024],[0.2000000000000000111,0.2000000000000000111,0.2000000000000000111,0.2000000000000000111,0.2000000000000000111]],["v54"]],["Annotate",["b2","v54"],["meta_schedule.unroll_explicit"],[]],["EnterPostproc",[],[],[]],["Unannotate",["b36"],["meta_schedule.cooperative_fetch"],[]],["GetLoops",["b36"],[],["l55","l56","l57","l58","l59"]],["Split",["l59","None",125],[1,0],["l60","l61"]],["Bind",["l61"],["threadIdx.x"],[]],["Unannotate",["b45"],["meta_schedule.cooperative_fetch"],[]],["GetLoops",["b45"],[],["l62","l63","l64","l65","l66"]],["Split",["l66","None",125],[1,0],["l67","l68"]],["Bind",["l68"],["threadIdx.x"],[]],["GetBlock",[],["root","main"],["b69"]],["Unannotate",["b69"],["meta_schedule.unroll_explicit"],[]],["GetChildBlocks",["b69"],[],["b70","b71","b72","b73"]],["GetLoops",["b70"],[],["l74","l75","l76","l77","l78","l79"]],["GetLoops",["b71"],[],["l80","l81","l82","l83","l84","l85"]],["GetLoops",["b72"],[],["l86","l87","l88","l89","l90","l91","l92","l93","l94","l95"]],["Annotate",["l86",64],["pragma_auto_unroll_max_step"],[]],["Annotate",["l86",1],["pragma_unroll_explicit"],[]],["GetLoops",["b73"],[],["l96","l97","l98","l99","l100"]],["GetBlock",[],["matmul","main"],["b101"]],["GetLoops",["b101"],[],["l102","l103","l104","l105","l106","l107","l108","l109","l110","l111"]],["DecomposeReduction",["b101","l105"],[],["b112"]]],[[5,[1,1,1,1,1]],[7,[4,1,125,2,1]],[9,[128,2,2]],[26,2],[32,0],[35,2]]],[2.7968414463316403453e-05],{"arch":"sm_86","keys":["cuda","gpu"],"kind":"cuda","max_num_threads":1024,"max_shared_memory_per_block":49152,"max_threads_per_block":1024,"registers_per_block":65536,"tag":"","thread_warp_size":32},[["TENSOR","float32",[1,512]],["TENSOR","float32",[512,1000]],["TENSOR","float32",[1000]],["TENSOR","float32",[1,1000]]]]]
[0,[[[["GetBlock",[],["matmul","main"],["b0"]],["GetBlock",[],["T_add","main"],["b1"]],["GetBlock",[],["root","main"],["b2"]],["Annotate",["b0","\"SSSRRSRS\""],["meta_schedule.tiling_structure"],[]],["GetLoops",["b0"],[],["l3","l4","l5"]],["SamplePerfectTile",["l3"],[5,64],["v6","v7","v8","v9","v10"]],["Split",["l3","v6","v7","v8","v9","v10"],[1,0],["l11","l12","l13","l14","l15"]],["SamplePerfectTile",["l4"],[5,64],["v16","v17","v18","v19","v20"]],["Split",["l4","v16","v17","v18","v19","v20"],[1,0],["l21","l22","l23","l24","l25"]],["SamplePerfectTile",["l5"],[3,64],["v26","v27","v28"]],["Split",["l5","v26","v27","v28"],[1,0],["l29","l30","l31"]],["Reorder",["l11","l21","l12","l22","l13","l23","l29","l30","l14","l24","l31","l15","l25"],[],[]],["Fuse",["l11","l21"],[1],["l32"]],["Bind",["l32"],["blockIdx.x"],[]],["Fuse",["l12","l22"],[1],["l33"]],["Bind",["l33"],["vthread.x"],[]],["Fuse",["l13","l23"],[1],["l34"]],["Bind",["l34"],["threadIdx.x"],[]],["Annotate",["b0",32],["meta_schedule.thread_extent_low_inclusive"],[]],["Annotate",["b0",1024],["meta_schedule.thread_extent_high_inclusive"],[]],["CacheWrite",["b0",[]],[0,"local"],["b35"]],["ReverseComputeAt",["b35","l34"],[1,-1],[]],["CacheRead",["b0",["b0"]],[0,"shared"],["b36"]],["ComputeAt",["b36","l29"],[1,-1],[]],["GetLoops",["b36"],[],["l37","l38","l39","l40","l41","l42"]],["Fuse",["l41","l42"],[1],["l43"]],["SampleCategorical",[],[[1,2,3,4],[0.25,0.25,0.25,0.25]],["v44"]],["Annotate",["b36","v44"],["meta_schedule.cooperative_fetch"],[]],["CacheRead",["b0",["b0"]],[1,"shared"],["b45"]],["ComputeAt",["b45","l29"],[1,-1],[]],["GetLoops",["b45"],[],["l46","l47","l48","l49","l50","l51"]],["Fuse",["l50","l51"],[1],["l52"]],["SampleCategorical",[],[[1,2,3,4],[0.25,0.25,0.25,0.25]],["v53"]],["Annotate",["b45","v53"],["meta_schedule.cooperative_fetch"],[]],["ReverseComputeInline",["b1"],[],[]],["SampleCategorical",[],[[0,16,64,512,1024],[0.2000000000000000111,0.2000000000000000111,0.2000000000000000111,0.2000000000000000111,0.2000000000000000111]],["v54"]],["Annotate",["b2","v54"],["meta_schedule.unroll_explicit"],[]],["EnterPostproc",[],[],[]],["Unannotate",["b36"],["meta_schedule.cooperative_fetch"],[]],["GetLoops",["b36"],[],["l55","l56","l57","l58","l59"]],["Split",["l59","None",250],[1,0],["l60","l61"]],["Bind",["l61"],["threadIdx.x"],[]],["Unannotate",["b45"],["meta_schedule.cooperative_fetch"],[]],["GetLoops",["b45"],[],["l62","l63","l64","l65","l66"]],["Split",["l66","None",250],[1,0],["l67","l68"]],["Bind",["l68"],["threadIdx.x"],[]],["GetBlock",[],["root","main"],["b69"]],["Unannotate",["b69"],["meta_schedule.unroll_explicit"],[]],["GetChildBlocks",["b69"],[],["b70","b71","b72","b73"]],["GetLoops",["b70"],[],["l74","l75","l76","l77","l78","l79"]],["GetLoops",["b71"],[],["l80","l81","l82","l83","l84","l85"]],["GetLoops",["b72"],[],["l86","l87","l88","l89","l90","l91","l92","l93","l94","l95"]],["Annotate",["l86",64],["pragma_auto_unroll_max_step"],[]],["Annotate",["l86",1],["pragma_unroll_explicit"],[]],["GetLoops",["b73"],[],["l96","l97","l98","l99","l100"]],["GetBlock",[],["matmul","main"],["b101"]],["GetLoops",["b101"],[],["l102","l103","l104","l105","l106","l107","l108","l109","l110","l111"]],["DecomposeReduction",["b101","l105"],[],["b112"]]],[[5,[1,1,1,1,1]],[7,[2,1,250,2,1]],[9,[128,2,2]],[26,2],[32,2],[35,2]]],[4.2316396360759493559e-05],{"arch":"sm_86","keys":["cuda","gpu"],"kind":"cuda","max_num_threads":1024,"max_shared_memory_per_block":49152,"max_threads_per_block":1024,"registers_per_block":65536,"tag":"","thread_warp_size":32},[["TENSOR","float32",[1,512]],["TENSOR","float32",[512,1000]],["TENSOR","float32",[1000]],["TENSOR","float32",[1,1000]]]]]
[0,[[[["GetBlock",[],["matmul","main"],["b0"]],["GetBlock",[],["T_add","main"],["b1"]],["GetBlock",[],["root","main"],["b2"]],["Annotate",["b0","\"SSSRRSRS\""],["meta_schedule.tiling_structure"],[]],["GetLoops",["b0"],[],["l3","l4","l5"]],["SamplePerfectTile",["l3"],[5,64],["v6","v7","v8","v9","v10"]],["Split",["l3","v6","v7","v8","v9","v10"],[1,0],["l11","l12","l13","l14","l15"]],["SamplePerfectTile",["l4"],[5,64],["v16","v17","v18","v19","v20"]],["Split",["l4","v16","v17","v18","v19","v20"],[1,0],["l21","l22","l23","l24","l25"]],["SamplePerfectTile",["l5"],[3,64],["v26","v27","v28"]],["Split",["l5","v26","v27","v28"],[1,0],["l29","l30","l31"]],["Reorder",["l11","l21","l12","l22","l13","l23","l29","l30","l14","l24","l31","l15","l25"],[],[]],["Fuse",["l11","l21"],[1],["l32"]],["Bind",["l32"],["blockIdx.x"],[]],["Fuse",["l12","l22"],[1],["l33"]],["Bind",["l33"],["vthread.x"],[]],["Fuse",["l13","l23"],[1],["l34"]],["Bind",["l34"],["threadIdx.x"],[]],["Annotate",["b0",32],["meta_schedule.thread_extent_low_inclusive"],[]],["Annotate",["b0",1024],["meta_schedule.thread_extent_high_inclusive"],[]],["CacheWrite",["b0",[]],[0,"local"],["b35"]],["ReverseComputeAt",["b35","l34"],[1,-1],[]],["CacheRead",["b0",["b0"]],[0,"shared"],["b36"]],["ComputeAt",["b36","l29"],[1,-1],[]],["GetLoops",["b36"],[],["l37","l38","l39","l40","l41","l42"]],["Fuse",["l41","l42"],[1],["l43"]],["SampleCategorical",[],[[1,2,3,4],[0.25,0.25,0.25,0.25]],["v44"]],["Annotate",["b36","v44"],["meta_schedule.cooperative_fetch"],[]],["CacheRead",["b0",["b0"]],[1,"shared"],["b45"]],["ComputeAt",["b45","l29"],[1,-1],[]],["GetLoops",["b45"],[],["l46","l47","l48","l49","l50","l51"]],["Fuse",["l50","l51"],[1],["l52"]],["SampleCategorical",[],[[1,2,3,4],[0.25,0.25,0.25,0.25]],["v53"]],["Annotate",["b45","v53"],["meta_schedule.cooperative_fetch"],[]],["ReverseComputeInline",["b1"],[],[]],["SampleCategorical",[],[[0,16,64,512,1024],[0.2000000000000000111,0.2000000000000000111,0.2000000000000000111,0.2000000000000000111,0.2000000000000000111]],["v54"]],["Annotate",["b2","v54"],["meta_schedule.unroll_explicit"],[]],["EnterPostproc",[],[],[]],["Unannotate",["b36"],["meta_schedule.cooperative_fetch"],[]],["GetLoops",["b36"],[],["l55","l56","l57","l58","l59"]],["Split",["l59","None",200],[1,0],["l60","l61"]],["Bind",["l61"],["threadIdx.x"],[]],["Unannotate",["b45"],["meta_schedule.cooperative_fetch"],[]],["GetLoops",["b45"],[],["l62","l63","l64","l65","l66"]],["Split",["l66","None",200,2],[1,0],["l67","l68","l69"]],["Vectorize",["l69"],[],[]],["Bind",["l68"],["threadIdx.x"],[]],["GetBlock",[],["root","main"],["b70"]],["Unannotate",["b70"],["meta_schedule.unroll_explicit"],[]],["GetChildBlocks",["b70"],[],["b71","b72","b73","b74"]],["GetLoops",["b71"],[],["l75","l76","l77","l78","l79","l80"]],["GetLoops",["b72"],[],["l81","l82","l83","l84","l85","l86","l87"]],["GetLoops",["b73"],[],["l88","l89","l90","l91","l92","l93","l94","l95","l96","l97"]],["GetLoops",["b74"],[],["l98","l99","l100","l101","l102"]],["GetBlock",[],["matmul","main"],["b103"]],["GetLoops",["b103"],[],["l104","l105","l106","l107","l108","l109","l110","l111","l112","l113"]],["DecomposeReduction",["b103","l107"],[],["b114"]]],[[5,[1,1,1,1,1]],[7,[5,1,200,1,1]],[9,[16,2,16]],[26,0],[32,1],[35,0]]],[1.5822796723676079268e-05],{"arch":"sm_86","keys":["cuda","gpu"],"kind":"cuda","max_num_threads":1024,"max_shared_memory_per_block":49152,"max_threads_per_block":1024,"registers_per_block":65536,"tag":"","thread_warp_size":32},[["TENSOR","float32",[1,512]],["TENSOR","float32",[512,1000]],["TENSOR","float32",[1000]],["TENSOR","float32",[1,1000]]]]]
[0,[[[["GetBlock",[],["matmul","main"],["b0"]],["GetBlock",[],["T_add","main"],["b1"]],["GetBlock",[],["root","main"],["b2"]],["Annotate",["b0","\"SSSRRSRS\""],["meta_schedule.tiling_structure"],[]],["GetLoops",["b0"],[],["l3","l4","l5"]],["SamplePerfectTile",["l3"],[5,64],["v6","v7","v8","v9","v10"]],["Split",["l3","v6","v7","v8","v9","v10"],[1,0],["l11","l12","l13","l14","l15"]],["SamplePerfectTile",["l4"],[5,64],["v16","v17","v18","v19","v20"]],["Split",["l4","v16","v17","v18","v19","v20"],[1,0],["l21","l22","l23","l24","l25"]],["SamplePerfectTile",["l5"],[3,64],["v26","v27","v28"]],["Split",["l5","v26","v27","v28"],[1,0],["l29","l30","l31"]],["Reorder",["l11","l21","l12","l22","l13","l23","l29","l30","l14","l24","l31","l15","l25"],[],[]],["Fuse",["l11","l21"],[1],["l32"]],["Bind",["l32"],["blockIdx.x"],[]],["Fuse",["l12","l22"],[1],["l33"]],["Bind",["l33"],["vthread.x"],[]],["Fuse",["l13","l23"],[1],["l34"]],["Bind",["l34"],["threadIdx.x"],[]],["Annotate",["b0",32],["meta_schedule.thread_extent_low_inclusive"],[]],["Annotate",["b0",1024],["meta_schedule.thread_extent_high_inclusive"],[]],["CacheWrite",["b0",[]],[0,"local"],["b35"]],["ReverseComputeAt",["b35","l34"],[1,-1],[]],["CacheRead",["b0",["b0"]],[0,"shared"],["b36"]],["ComputeAt",["b36","l29"],[1,-1],[]],["GetLoops",["b36"],[],["l37","l38","l39","l40","l41","l42"]],["Fuse",["l41","l42"],[1],["l43"]],["SampleCategorical",[],[[1,2,3,4],[0.25,0.25,0.25,0.25]],["v44"]],["Annotate",["b36","v44"],["meta_schedule.cooperative_fetch"],[]],["CacheRead",["b0",["b0"]],[1,"shared"],["b45"]],["ComputeAt",["b45","l29"],[1,-1],[]],["GetLoops",["b45"],[],["l46","l47","l48","l49","l50","l51"]],["Fuse",["l50","l51"],[1],["l52"]],["SampleCategorical",[],[[1,2,3,4],[0.25,0.25,0.25,0.25]],["v53"]],["Annotate",["b45","v53"],["meta_schedule.cooperative_fetch"],[]],["ReverseComputeInline",["b1"],[],[]],["SampleCategorical",[],[[0,16,64,512,1024],[0.2000000000000000111,0.2000000000000000111,0.2000000000000000111,0.2000000000000000111,0.2000000000000000111]],["v54"]],["Annotate",["b2","v54"],["meta_schedule.unroll_explicit"],[]],["EnterPostproc",[],[],[]],["Unannotate",["b36"],["meta_schedule.cooperative_fetch"],[]],["GetLoops",["b36"],[],["l55","l56","l57","l58","l59"]],["Split",["l59","None",100,4],[1,0],["l60","l61","l62"]],["Vectorize",["l62"],[],[]],["Bind",["l61"],["threadIdx.x"],[]],["Unannotate",["b45"],["meta_schedule.cooperative_fetch"],[]],["GetLoops",["b45"],[],["l63","l64","l65","l66","l67"]],["Split",["l67","None",100],[1,0],["l68","l69"]],["Bind",["l69"],["threadIdx.x"],[]],["GetBlock",[],["root","main"],["b70"]],["Unannotate",["b70"],["meta_schedule.unroll_explicit"],[]],["GetChildBlocks",["b70"],[],["b71","b72","b73","b74"]],["GetLoops",["b71"],[],["l75","l76","l77","l78","l79","l80","l81"]],["GetLoops",["b72"],[],["l82","l83","l84","l85","l86","l87"]],["GetLoops",["b73"],[],["l88","l89","l90","l91","l92","l93","l94","l95","l96","l97"]],["Annotate",["l88",16],["pragma_auto_unroll_max_step"],[]],["Annotate",["l88",1],["pragma_unroll_explicit"],[]],["GetLoops",["b74"],[],["l98","l99","l100","l101","l102"]],["GetBlock",[],["matmul","main"],["b103"]],["GetLoops",["b103"],[],["l104","l105","l106","l107","l108","l109","l110","l111","l112","l113"]],["DecomposeReduction",["b103","l107"],[],["b114"]]],[[5,[1,1,1,1,1]],[7,[1,2,100,5,1]],[9,[64,4,2]],[26,3],[32,2],[35,1]]],[9.1607759710930441554e-05],{"arch":"sm_86","keys":["cuda","gpu"],"kind":"cuda","max_num_threads":1024,"max_shared_memory_per_block":49152,"max_threads_per_block":1024,"registers_per_block":65536,"tag":"","thread_warp_size":32},[["TENSOR","float32",[1,512]],["TENSOR","float32",[512,1000]],["TENSOR","float32",[1000]],["TENSOR","float32",[1,1000]]]]]
[0,[[[["GetBlock",[],["matmul","main"],["b0"]],["GetBlock",[],["T_add","main"],["b1"]],["GetBlock",[],["root","main"],["b2"]],["Annotate",["b0","\"SSSRRSRS\""],["meta_schedule.tiling_structure"],[]],["GetLoops",["b0"],[],["l3","l4","l5"]],["SamplePerfectTile",["l3"],[5,64],["v6","v7","v8","v9","v10"]],["Split",["l3","v6","v7","v8","v9","v10"],[1,0],["l11","l12","l13","l14","l15"]],["SamplePerfectTile",["l4"],[5,64],["v16","v17","v18","v19","v20"]],["Split",["l4","v16","v17","v18","v19","v20"],[1,0],["l21","l22","l23","l24","l25"]],["SamplePerfectTile",["l5"],[3,64],["v26","v27","v28"]],["Split",["l5","v26","v27","v28"],[1,0],["l29","l30","l31"]],["Reorder",["l11","l21","l12","l22","l13","l23","l29","l30","l14","l24","l31","l15","l25"],[],[]],["Fuse",["l11","l21"],[1],["l32"]],["Bind",["l32"],["blockIdx.x"],[]],["Fuse",["l12","l22"],[1],["l33"]],["Bind",["l33"],["vthread.x"],[]],["Fuse",["l13","l23"],[1],["l34"]],["Bind",["l34"],["threadIdx.x"],[]],["Annotate",["b0",32],["meta_schedule.thread_extent_low_inclusive"],[]],["Annotate",["b0",1024],["meta_schedule.thread_extent_high_inclusive"],[]],["CacheWrite",["b0",[]],[0,"local"],["b35"]],["ReverseComputeAt",["b35","l34"],[1,-1],[]],["CacheRead",["b0",["b0"]],[0,"shared"],["b36"]],["ComputeAt",["b36","l29"],[1,-1],[]],["GetLoops",["b36"],[],["l37","l38","l39","l40","l41","l42"]],["Fuse",["l41","l42"],[1],["l43"]],["SampleCategorical",[],[[1,2,3,4],[0.25,0.25,0.25,0.25]],["v44"]],["Annotate",["b36","v44"],["meta_schedule.cooperative_fetch"],[]],["CacheRead",["b0",["b0"]],[1,"shared"],["b45"]],["ComputeAt",["b45","l29"],[1,-1],[]],["GetLoops",["b45"],[],["l46","l47","l48","l49","l50","l51"]],["Fuse",["l50","l51"],[1],["l52"]],["SampleCategorical",[],[[1,2,3,4],[0.25,0.25,0.25,0.25]],["v53"]],["Annotate",["b45","v53"],["meta_schedule.cooperative_fetch"],[]],["ReverseComputeInline",["b1"],[],[]],["SampleCategorical",[],[[0,16,64,512,1024],[0.2000000000000000111,0.2000000000000000111,0.2000000000000000111,0.2000000000000000111,0.2000000000000000111]],["v54"]],["Annotate",["b2","v54"],["meta_schedule.unroll_explicit"],[]],["EnterPostproc",[],[],[]],["Unannotate",["b36"],["meta_schedule.cooperative_fetch"],[]],["GetLoops",["b36"],[],["l55","l56","l57","l58","l59"]],["Split",["l59","None",50],[1,0],["l60","l61"]],["Bind",["l61"],["threadIdx.x"],[]],["Unannotate",["b45"],["meta_schedule.cooperative_fetch"],[]],["GetLoops",["b45"],[],["l62","l63","l64","l65","l66"]],["Split",["l66","None",50,4],[1,0],["l67","l68","l69"]],["Vectorize",["l69"],[],[]],["Bind",["l68"],["threadIdx.x"],[]],["GetBlock",[],["root","main"],["b70"]],["Unannotate",["b70"],["meta_schedule.unroll_explicit"],[]],["GetChildBlocks",["b70"],[],["b71","b72","b73","b74"]],["GetLoops",["b71"],[],["l75","l76","l77","l78","l79","l80"]],["GetLoops",["b72"],[],["l81","l82","l83","l84","l85","l86","l87"]],["GetLoops",["b73"],[],["l88","l89","l90","l91","l92","l93","l94","l95","l96","l97"]],["Annotate",["l88",1024],["pragma_auto_unroll_max_step"],[]],["Annotate",["l88",1],["pragma_unroll_explicit"],[]],["GetLoops",["b74"],[],["l98","l99","l100","l101","l102"]],["GetBlock",[],["matmul","main"],["b103"]],["GetLoops",["b103"],[],["l104","l105","l106","l107","l108","l109","l110","l111","l112","l113"]],["DecomposeReduction",["b103","l107"],[],["b114"]]],[[5,[1,1,1,1,1]],[7,[20,1,50,1,1]],[9,[32,16,1]],[26,0],[32,3],[35,4]]],[7.6559837656995555395e-06],{"arch":"sm_86","keys":["cuda","gpu"],"kind":"cuda","max_num_threads":1024,"max_shared_memory_per_block":49152,"max_threads_per_block":1024,"registers_per_block":65536,"tag":"","thread_warp_size":32},[["TENSOR","float32",[1,512]],["TENSOR","float32",[512,1000]],["TENSOR","float32",[1000]],["TENSOR","float32",[1,1000]]]]]
[0,[[[["GetBlock",[],["matmul","main"],["b0"]],["GetBlock",[],["T_add","main"],["b1"]],["GetBlock",[],["root","main"],["b2"]],["Annotate",["b0","\"SSSRRSRS\""],["meta_schedule.tiling_structure"],[]],["GetLoops",["b0"],[],["l3","l4","l5"]],["SamplePerfectTile",["l3"],[5,64],["v6","v7","v8","v9","v10"]],["Split",["l3","v6","v7","v8","v9","v10"],[1,0],["l11","l12","l13","l14","l15"]],["SamplePerfectTile",["l4"],[5,64],["v16","v17","v18","v19","v20"]],["Split",["l4","v16","v17","v18","v19","v20"],[1,0],["l21","l22","l23","l24","l25"]],["SamplePerfectTile",["l5"],[3,64],["v26","v27","v28"]],["Split",["l5","v26","v27","v28"],[1,0],["l29","l30","l31"]],["Reorder",["l11","l21","l12","l22","l13","l23","l29","l30","l14","l24","l31","l15","l25"],[],[]],["Fuse",["l11","l21"],[1],["l32"]],["Bind",["l32"],["blockIdx.x"],[]],["Fuse",["l12","l22"],[1],["l33"]],["Bind",["l33"],["vthread.x"],[]],["Fuse",["l13","l23"],[1],["l34"]],["Bind",["l34"],["threadIdx.x"],[]],["Annotate",["b0",32],["meta_schedule.thread_extent_low_inclusive"],[]],["Annotate",["b0",1024],["meta_schedule.thread_extent_high_inclusive"],[]],["CacheWrite",["b0",[]],[0,"local"],["b35"]],["ReverseComputeAt",["b35","l34"],[1,-1],[]],["CacheRead",["b0",["b0"]],[0,"shared"],["b36"]],["ComputeAt",["b36","l29"],[1,-1],[]],["GetLoops",["b36"],[],["l37","l38","l39","l40","l41","l42"]],["Fuse",["l41","l42"],[1],["l43"]],["SampleCategorical",[],[[1,2,3,4],[0.25,0.25,0.25,0.25]],["v44"]],["Annotate",["b36","v44"],["meta_schedule.cooperative_fetch"],[]],["CacheRead",["b0",["b0"]],[1,"shared"],["b45"]],["ComputeAt",["b45","l29"],[1,-1],[]],["GetLoops",["b45"],[],["l46","l47","l48","l49","l50","l51"]],["Fuse",["l50","l51"],[1],["l52"]],["SampleCategorical",[],[[1,2,3,4],[0.25,0.25,0.25,0.25]],["v53"]],["Annotate",["b45","v53"],["meta_schedule.cooperative_fetch"],[]],["ReverseComputeInline",["b1"],[],[]],["SampleCategorical",[],[[0,16,64,512,1024],[0.2000000000000000111,0.2000000000000000111,0.2000000000000000111,0.2000000000000000111,0.2000000000000000111]],["v54"]],["Annotate",["b2","v54"],["meta_schedule.unroll_explicit"],[]],["EnterPostproc",[],[],[]],["Unannotate",["b36"],["meta_schedule.cooperative_fetch"],[]],["GetLoops",["b36"],[],["l55","l56","l57","l58","l59"]],["Split",["l59","None",500],[1,0],["l60","l61"]],["Bind",["l61"],["threadIdx.x"],[]],["Unannotate",["b45"],["meta_schedule.cooperative_fetch"],[]],["GetLoops",["b45"],[],["l62","l63","l64","l65","l66"]],["Split",["l66","None",500,2],[1,0],["l67","l68","l69"]],["Vectorize",["l69"],[],[]],["Bind",["l68"],["threadIdx.x"],[]],["GetBlock",[],["root","main"],["b70"]],["Unannotate",["b70"],["meta_schedule.unroll_explicit"],[]],["GetChildBlocks",["b70"],[],["b71","b72","b73","b74"]],["GetLoops",["b71"],[],["l75","l76","l77","l78","l79","l80"]],["GetLoops",["b72"],[],["l81","l82","l83","l84","l85","l86","l87"]],["GetLoops",["b73"],[],["l88","l89","l90","l91","l92","l93","l94","l95","l96","l97"]],["GetLoops",["b74"],[],["l98","l99","l100","l101","l102"]],["GetBlock",[],["matmul","main"],["b103"]],["GetLoops",["b103"],[],["l104","l105","l106","l107","l108","l109","l110","l111","l112","l113"]],["DecomposeReduction",["b103","l107"],[],["b114"]]],[[5,[1,1,1,1,1]],[7,[2,1,500,1,1]],[9,[32,16,1]],[26,0],[32,1],[35,0]]],[3.4849902610221541251e-05],{"arch":"sm_86","keys":["cuda","gpu"],"kind":"cuda","max_num_threads":1024,"max_shared_memory_per_block":49152,"max_threads_per_block":1024,"registers_per_block":65536,"tag":"","thread_warp_size":32},[["TENSOR","float32",[1,512]],["TENSOR","float32",[512,1000]],["TENSOR","float32",[1000]],["TENSOR","float32",[1,1000]]]]]
[0,[[[["GetBlock",[],["matmul","main"],["b0"]],["GetBlock",[],["T_add","main"],["b1"]],["GetBlock",[],["root","main"],["b2"]],["Annotate",["b0","\"SSSRRSRS\""],["meta_schedule.tiling_structure"],[]],["GetLoops",["b0"],[],["l3","l4","l5"]],["SamplePerfectTile",["l3"],[5,64],["v6","v7","v8","v9","v10"]],["Split",["l3","v6","v7","v8","v9","v10"],[1,0],["l11","l12","l13","l14","l15"]],["SamplePerfectTile",["l4"],[5,64],["v16","v17","v18","v19","v20"]],["Split",["l4","v16","v17","v18","v19","v20"],[1,0],["l21","l22","l23","l24","l25"]],["SamplePerfectTile",["l5"],[3,64],["v26","v27","v28"]],["Split",["l5","v26","v27","v28"],[1,0],["l29","l30","l31"]],["Reorder",["l11","l21","l12","l22","l13","l23","l29","l30","l14","l24","l31","l15","l25"],[],[]],["Fuse",["l11","l21"],[1],["l32"]],["Bind",["l32"],["blockIdx.x"],[]],["Fuse",["l12","l22"],[1],["l33"]],["Bind",["l33"],["vthread.x"],[]],["Fuse",["l13","l23"],[1],["l34"]],["Bind",["l34"],["threadIdx.x"],[]],["Annotate",["b0",32],["meta_schedule.thread_extent_low_inclusive"],[]],["Annotate",["b0",1024],["meta_schedule.thread_extent_high_inclusive"],[]],["CacheWrite",["b0",[]],[0,"local"],["b35"]],["ReverseComputeAt",["b35","l34"],[1,-1],[]],["CacheRead",["b0",["b0"]],[0,"shared"],["b36"]],["ComputeAt",["b36","l29"],[1,-1],[]],["GetLoops",["b36"],[],["l37","l38","l39","l40","l41","l42"]],["Fuse",["l41","l42"],[1],["l43"]],["SampleCategorical",[],[[1,2,3,4],[0.25,0.25,0.25,0.25]],["v44"]],["Annotate",["b36","v44"],["meta_schedule.cooperative_fetch"],[]],["CacheRead",["b0",["b0"]],[1,"shared"],["b45"]],["ComputeAt",["b45","l29"],[1,-1],[]],["GetLoops",["b45"],[],["l46","l47","l48","l49","l50","l51"]],["Fuse",["l50","l51"],[1],["l52"]],["SampleCategorical",[],[[1,2,3,4],[0.25,0.25,0.25,0.25]],["v53"]],["Annotate",["b45","v53"],["meta_schedule.cooperative_fetch"],[]],["ReverseComputeInline",["b1"],[],[]],["SampleCategorical",[],[[0,16,64,512,1024],[0.2000000000000000111,0.2000000000000000111,0.2000000000000000111,0.2000000000000000111,0.2000000000000000111]],["v54"]],["Annotate",["b2","v54"],["meta_schedule.unroll_explicit"],[]],["EnterPostproc",[],[],[]],["Unannotate",["b36"],["meta_schedule.cooperative_fetch"],[]],["GetLoops",["b36"],[],["l55","l56","l57","l58","l59"]],["Split",["l59","None",500],[1,0],["l60","l61"]],["Bind",["l61"],["threadIdx.x"],[]],["Unannotate",["b45"],["meta_schedule.cooperative_fetch"],[]],["GetLoops",["b45"],[],["l62","l63","l64","l65","l66"]],["Split",["l66","None",500,2],[1,0],["l67","l68","l69"]],["Vectorize",["l69"],[],[]],["Bind",["l68"],["threadIdx.x"],[]],["GetBlock",[],["root","main"],["b70"]],["Unannotate",["b70"],["meta_schedule.unroll_explicit"],[]],["GetChildBlocks",["b70"],[],["b71","b72","b73","b74"]],["GetLoops",["b71"],[],["l75","l76","l77","l78","l79","l80"]],["GetLoops",["b72"],[],["l81","l82","l83","l84","l85","l86","l87"]],["GetLoops",["b73"],[],["l88","l89","l90","l91","l92","l93","l94","l95","l96","l97"]],["GetLoops",["b74"],[],["l98","l99","l100","l101","l102"]],["GetBlock",[],["matmul","main"],["b103"]],["GetLoops",["b103"],[],["l104","l105","l106","l107","l108","l109","l110","l111","l112","l113"]],["DecomposeReduction",["b103","l107"],[],["b114"]]],[[5,[1,1,1,1,1]],[7,[2,1,500,1,1]],[9,[512,1,1]],[26,3],[32,1],[35,0]]],[7.8226938473520242425e-05],{"arch":"sm_86","keys":["cuda","gpu"],"kind":"cuda","max_num_threads":1024,"max_shared_memory_per_block":49152,"max_threads_per_block":1024,"registers_per_block":65536,"tag":"","thread_warp_size":32},[["TENSOR","float32",[1,512]],["TENSOR","float32",[512,1000]],["TENSOR","float32",[1000]],["TENSOR","float32",[1,1000]]]]]
[0,[[[["GetBlock",[],["matmul","main"],["b0"]],["GetBlock",[],["T_add","main"],["b1"]],["GetBlock",[],["root","main"],["b2"]],["Annotate",["b0","\"SSSRRSRS\""],["meta_schedule.tiling_structure"],[]],["GetLoops",["b0"],[],["l3","l4","l5"]],["SamplePerfectTile",["l3"],[5,64],["v6","v7","v8","v9","v10"]],["Split",["l3","v6","v7","v8","v9","v10"],[1,0],["l11","l12","l13","l14","l15"]],["SamplePerfectTile",["l4"],[5,64],["v16","v17","v18","v19","v20"]],["Split",["l4","v16","v17","v18","v19","v20"],[1,0],["l21","l22","l23","l24","l25"]],["SamplePerfectTile",["l5"],[3,64],["v26","v27","v28"]],["Split",["l5","v26","v27","v28"],[1,0],["l29","l30","l31"]],["Reorder",["l11","l21","l12","l22","l13","l23","l29","l30","l14","l24","l31","l15","l25"],[],[]],["Fuse",["l11","l21"],[1],["l32"]],["Bind",["l32"],["blockIdx.x"],[]],["Fuse",["l12","l22"],[1],["l33"]],["Bind",["l33"],["vthread.x"],[]],["Fuse",["l13","l23"],[1],["l34"]],["Bind",["l34"],["threadIdx.x"],[]],["Annotate",["b0",32],["meta_schedule.thread_extent_low_inclusive"],[]],["Annotate",["b0",1024],["meta_schedule.thread_extent_high_inclusive"],[]],["CacheWrite",["b0",[]],[0,"local"],["b35"]],["ReverseComputeAt",["b35","l34"],[1,-1],[]],["CacheRead",["b0",["b0"]],[0,"shared"],["b36"]],["ComputeAt",["b36","l29"],[1,-1],[]],["GetLoops",["b36"],[],["l37","l38","l39","l40","l41","l42"]],["Fuse",["l41","l42"],[1],["l43"]],["SampleCategorical",[],[[1,2,3,4],[0.25,0.25,0.25,0.25]],["v44"]],["Annotate",["b36","v44"],["meta_schedule.cooperative_fetch"],[]],["CacheRead",["b0",["b0"]],[1,"shared"],["b45"]],["ComputeAt",["b45","l29"],[1,-1],[]],["GetLoops",["b45"],[],["l46","l47","l48","l49","l50","l51"]],["Fuse",["l50","l51"],[1],["l52"]],["SampleCategorical",[],[[1,2,3,4],[0.25,0.25,0.25,0.25]],["v53"]],["Annotate",["b45","v53"],["meta_schedule.cooperative_fetch"],[]],["Fuse",["l29"],[1],["l54"]],["Annotate",["l54",[0,0,2]],["software_pipeline_stage"],[]],["Annotate",["l54",[0,1,2]],["software_pipeline_order"],[]],["Annotate",["l54",[0]],["software_pipeline_async_stages"],[]],["ReverseComputeInline",["b1"],[],[]],["SampleCategorical",[],[[0,16,64,512,1024],[0.2000000000000000111,0.2000000000000000111,0.2000000000000000111,0.2000000000000000111,0.2000000000000000111]],["v55"]],["Annotate",["b2","v55"],["meta_schedule.unroll_explicit"],[]],["EnterPostproc",[],[],[]],["Unannotate",["b36"],["meta_schedule.cooperative_fetch"],[]],["GetLoops",["b36"],[],["l56","l57","l58","l59","l60"]],["Split",["l60","None",100],[1,0],["l61","l62"]],["Bind",["l62"],["threadIdx.x"],[]],["Unannotate",["b45"],["meta_schedule.cooperative_fetch"],[]],["GetLoops",["b45"],[],["l63","l64","l65","l66","l67"]],["Split",["l67","None",100],[1,0],["l68","l69"]],["Bind",["l69"],["threadIdx.x"],[]],["GetBlock",[],["root","main"],["b70"]],["Unannotate",["b70"],["meta_schedule.unroll_explicit"],[]],["GetChildBlocks",["b70"],[],["b71","b72","b73","b74"]],["GetLoops",["b71"],[],["l75","l76","l77","l78","l79","l80"]],["GetLoops",["b72"],[],["l81","l82","l83","l84","l85","l86"]],["GetLoops",["b73"],[],["l87","l88","l89","l90","l91","l92","l93","l94","l95","l96"]],["Annotate",["l87",1024],["pragma_auto_unroll_max_step"],[]],["Annotate",["l87",1],["pragma_unroll_explicit"],[]],["GetLoops",["b74"],[],["l97","l98","l99","l100","l101"]],["GetBlock",[],["matmul","main"],["b102"]],["GetLoops",["b102"],[],["l103","l104","l105","l106","l107","l108","l109","l110","l111","l112"]],["DecomposeReduction",["b102","l106"],[],["b113"]]],[[5,[1,1,1,1,1]],[7,[2,1,100,5,1]],[9,[256,1,2]],[26,3],[32,2],[39,4]]],[8.321072801972062376e-05],{"arch":"sm_86","keys":["cuda","gpu"],"kind":"cuda","max_num_threads":1024,"max_shared_memory_per_block":49152,"max_threads_per_block":1024,"registers_per_block":65536,"tag":"","thread_warp_size":32},[["TENSOR","float32",[1,512]],["TENSOR","float32",[512,1000]],["TENSOR","float32",[1000]],["TENSOR","float32",[1,1000]]]]]
[0,[[[["GetBlock",[],["matmul","main"],["b0"]],["GetBlock",[],["T_add","main"],["b1"]],["GetBlock",[],["root","main"],["b2"]],["Annotate",["b0","\"SSSRRSRS\""],["meta_schedule.tiling_structure"],[]],["GetLoops",["b0"],[],["l3","l4","l5"]],["SamplePerfectTile",["l3"],[5,64],["v6","v7","v8","v9","v10"]],["Split",["l3","v6","v7","v8","v9","v10"],[1,0],["l11","l12","l13","l14","l15"]],["SamplePerfectTile",["l4"],[5,64],["v16","v17","v18","v19","v20"]],["Split",["l4","v16","v17","v18","v19","v20"],[1,0],["l21","l22","l23","l24","l25"]],["SamplePerfectTile",["l5"],[3,64],["v26","v27","v28"]],["Split",["l5","v26","v27","v28"],[1,0],["l29","l30","l31"]],["Reorder",["l11","l21","l12","l22","l13","l23","l29","l30","l14","l24","l31","l15","l25"],[],[]],["Fuse",["l11","l21"],[1],["l32"]],["Bind",["l32"],["blockIdx.x"],[]],["Fuse",["l12","l22"],[1],["l33"]],["Bind",["l33"],["vthread.x"],[]],["Fuse",["l13","l23"],[1],["l34"]],["Bind",["l34"],["threadIdx.x"],[]],["Annotate",["b0",32],["meta_schedule.thread_extent_low_inclusive"],[]],["Annotate",["b0",1024],["meta_schedule.thread_extent_high_inclusive"],[]],["CacheWrite",["b0",[]],[0,"local"],["b35"]],["ReverseComputeAt",["b35","l34"],[1,-1],[]],["CacheRead",["b0",["b0"]],[0,"shared"],["b36"]],["ComputeAt",["b36","l29"],[1,-1],[]],["GetLoops",["b36"],[],["l37","l38","l39","l40","l41","l42"]],["Fuse",["l41","l42"],[1],["l43"]],["SampleCategorical",[],[[1,2,3,4],[0.25,0.25,0.25,0.25]],["v44"]],["Annotate",["b36","v44"],["meta_schedule.cooperative_fetch"],[]],["CacheRead",["b0",["b0"]],[1,"shared"],["b45"]],["ComputeAt",["b45","l29"],[1,-1],[]],["GetLoops",["b45"],[],["l46","l47","l48","l49","l50","l51"]],["Fuse",["l50","l51"],[1],["l52"]],["SampleCategorical",[],[[1,2,3,4],[0.25,0.25,0.25,0.25]],["v53"]],["Annotate",["b45","v53"],["meta_schedule.cooperative_fetch"],[]],["ReverseComputeInline",["b1"],[],[]],["SampleCategorical",[],[[0,16,64,512,1024],[0.2000000000000000111,0.2000000000000000111,0.2000000000000000111,0.2000000000000000111,0.2000000000000000111]],["v54"]],["Annotate",["b2","v54"],["meta_schedule.unroll_explicit"],[]],["EnterPostproc",[],[],[]],["Unannotate",["b36"],["meta_schedule.cooperative_fetch"],[]],["GetLoops",["b36"],[],["l55","l56","l57","l58","l59"]],["Split",["l59","None",50,4],[1,0],["l60","l61","l62"]],["Vectorize",["l62"],[],[]],["Bind",["l61"],["threadIdx.x"],[]],["Unannotate",["b45"],["meta_schedule.cooperative_fetch"],[]],["GetLoops",["b45"],[],["l63","l64","l65","l66","l67"]],["Split",["l67","None",50,2],[1,0],["l68","l69","l70"]],["Vectorize",["l70"],[],[]],["Bind",["l69"],["threadIdx.x"],[]],["GetBlock",[],["root","main"],["b71"]],["Unannotate",["b71"],["meta_schedule.unroll_explicit"],[]],["GetChildBlocks",["b71"],[],["b72","b73","b74","b75"]],["GetLoops",["b72"],[],["l76","l77","l78","l79","l80","l81","l82"]],["GetLoops",["b73"],[],["l83","l84","l85","l86","l87","l88","l89"]],["GetLoops",["b74"],[],["l90","l91","l92","l93","l94","l95","l96","l97","l98","l99"]],["Annotate",["l90",16],["pragma_auto_unroll_max_step"],[]],["Annotate",["l90",1],["pragma_unroll_explicit"],[]],["GetLoops",["b75"],[],["l100","l101","l102","l103","l104"]],["GetBlock",[],["matmul","main"],["b105"]],["GetLoops",["b105"],[],["l106","l107","l108","l109","l110","l111","l112","l113","l114","l115"]],["DecomposeReduction",["b105","l109"],[],["b116"]]],[[5,[1,1,1,1,1]],[7,[1,1,50,20,1]],[9,[128,4,1]],[26,3],[32,1],[35,1]]],[9.2352118397085605577e-05],{"arch":"sm_86","keys":["cuda","gpu"],"kind":"cuda","max_num_threads":1024,"max_shared_memory_per_block":49152,"max_threads_per_block":1024,"registers_per_block":65536,"tag":"","thread_warp_size":32},[["TENSOR","float32",[1,512]],["TENSOR","float32",[512,1000]],["TENSOR","float32",[1000]],["TENSOR","float32",[1,1000]]]]]
[0,[[[["GetBlock",[],["matmul","main"],["b0"]],["GetBlock",[],["T_add","main"],["b1"]],["GetBlock",[],["root","main"],["b2"]],["Annotate",["b0","\"SSSRRSRS\""],["meta_schedule.tiling_structure"],[]],["GetLoops",["b0"],[],["l3","l4","l5"]],["SamplePerfectTile",["l3"],[5,64],["v6","v7","v8","v9","v10"]],["Split",["l3","v6","v7","v8","v9","v10"],[1,0],["l11","l12","l13","l14","l15"]],["SamplePerfectTile",["l4"],[5,64],["v16","v17","v18","v19","v20"]],["Split",["l4","v16","v17","v18","v19","v20"],[1,0],["l21","l22","l23","l24","l25"]],["SamplePerfectTile",["l5"],[3,64],["v26","v27","v28"]],["Split",["l5","v26","v27","v28"],[1,0],["l29","l30","l31"]],["Reorder",["l11","l21","l12","l22","l13","l23","l29","l30","l14","l24","l31","l15","l25"],[],[]],["Fuse",["l11","l21"],[1],["l32"]],["Bind",["l32"],["blockIdx.x"],[]],["Fuse",["l12","l22"],[1],["l33"]],["Bind",["l33"],["vthread.x"],[]],["Fuse",["l13","l23"],[1],["l34"]],["Bind",["l34"],["threadIdx.x"],[]],["Annotate",["b0",32],["meta_schedule.thread_extent_low_inclusive"],[]],["Annotate",["b0",1024],["meta_schedule.thread_extent_high_inclusive"],[]],["CacheWrite",["b0",[]],[0,"local"],["b35"]],["ReverseComputeAt",["b35","l34"],[1,-1],[]],["CacheRead",["b0",["b0"]],[0,"shared"],["b36"]],["ComputeAt",["b36","l29"],[1,-1],[]],["GetLoops",["b36"],[],["l37","l38","l39","l40","l41","l42"]],["Fuse",["l41","l42"],[1],["l43"]],["SampleCategorical",[],[[1,2,3,4],[0.25,0.25,0.25,0.25]],["v44"]],["Annotate",["b36","v44"],["meta_schedule.cooperative_fetch"],[]],["CacheRead",["b0",["b0"]],[1,"shared"],["b45"]],["ComputeAt",["b45","l29"],[1,-1],[]],["GetLoops",["b45"],[],["l46","l47","l48","l49","l50","l51"]],["Fuse",["l50","l51"],[1],["l52"]],["SampleCategorical",[],[[1,2,3,4],[0.25,0.25,0.25,0.25]],["v53"]],["Annotate",["b45","v53"],["meta_schedule.cooperative_fetch"],[]],["ReverseComputeInline",["b1"],[],[]],["SampleCategorical",[],[[0,16,64,512,1024],[0.2000000000000000111,0.2000000000000000111,0.2000000000000000111,0.2000000000000000111,0.2000000000000000111]],["v54"]],["Annotate",["b2","v54"],["meta_schedule.unroll_explicit"],[]],["EnterPostproc",[],[],[]],["Unannotate",["b36"],["meta_schedule.cooperative_fetch"],[]],["GetLoops",["b36"],[],["l55","l56","l57","l58","l59"]],["Split",["l59","None",125,4],[1,0],["l60","l61","l62"]],["Vectorize",["l62"],[],[]],["Bind",["l61"],["threadIdx.x"],[]],["Unannotate",["b45"],["meta_schedule.cooperative_fetch"],[]],["GetLoops",["b45"],[],["l63","l64","l65","l66","l67"]],["Split",["l67","None",125],[1,0],["l68","l69"]],["Bind",["l69"],["threadIdx.x"],[]],["GetBlock",[],["root","main"],["b70"]],["Unannotate",["b70"],["meta_schedule.unroll_explicit"],[]],["GetChildBlocks",["b70"],[],["b71","b72","b73","b74"]],["GetLoops",["b71"],[],["l75","l76","l77","l78","l79","l80","l81"]],["GetLoops",["b72"],[],["l82","l83","l84","l85","l86","l87"]],["GetLoops",["b73"],[],["l88","l89","l90","l91","l92","l93","l94","l95","l96","l97"]],["Annotate",["l88",64],["pragma_auto_unroll_max_step"],[]],["Annotate",["l88",1],["pragma_unroll_explicit"],[]],["GetLoops",["b74"],[],["l98","l99","l100","l101","l102"]],["GetBlock",[],["matmul","main"],["b103"]],["GetLoops",["b103"],[],["l104","l105","l106","l107","l108","l109","l110","l111","l112","l113"]],["DecomposeReduction",["b103","l107"],[],["b114"]]],[[5,[1,1,1,1,1]],[7,[4,1,125,2,1]],[9,[128,2,2]],[26,3],[32,2],[35,2]]],[2.7987155413786998044e-05],{"arch":"sm_86","keys":["cuda","gpu"],"kind":"cuda","max_num_threads":1024,"max_shared_memory_per_block":49152,"max_threads_per_block":1024,"registers_per_block":65536,"tag":"","thread_warp_size":32},[["TENSOR","float32",[1,512]],["TENSOR","float32",[512,1000]],["TENSOR","float32",[1000]],["TENSOR","float32",[1,1000]]]]]
[0,[[[["GetBlock",[],["matmul","main"],["b0"]],["GetBlock",[],["T_add","main"],["b1"]],["GetBlock",[],["root","main"],["b2"]],["Annotate",["b0","\"SSSRRSRS\""],["meta_schedule.tiling_structure"],[]],["GetLoops",["b0"],[],["l3","l4","l5"]],["SamplePerfectTile",["l3"],[5,64],["v6","v7","v8","v9","v10"]],["Split",["l3","v6","v7","v8","v9","v10"],[1,0],["l11","l12","l13","l14","l15"]],["SamplePerfectTile",["l4"],[5,64],["v16","v17","v18","v19","v20"]],["Split",["l4","v16","v17","v18","v19","v20"],[1,0],["l21","l22","l23","l24","l25"]],["SamplePerfectTile",["l5"],[3,64],["v26","v27","v28"]],["Split",["l5","v26","v27","v28"],[1,0],["l29","l30","l31"]],["Reorder",["l11","l21","l12","l22","l13","l23","l29","l30","l14","l24","l31","l15","l25"],[],[]],["Fuse",["l11","l21"],[1],["l32"]],["Bind",["l32"],["blockIdx.x"],[]],["Fuse",["l12","l22"],[1],["l33"]],["Bind",["l33"],["vthread.x"],[]],["Fuse",["l13","l23"],[1],["l34"]],["Bind",["l34"],["threadIdx.x"],[]],["Annotate",["b0",32],["meta_schedule.thread_extent_low_inclusive"],[]],["Annotate",["b0",1024],["meta_schedule.thread_extent_high_inclusive"],[]],["CacheWrite",["b0",[]],[0,"local"],["b35"]],["ReverseComputeAt",["b35","l34"],[1,-1],[]],["CacheRead",["b0",["b0"]],[0,"shared"],["b36"]],["ComputeAt",["b36","l29"],[1,-1],[]],["GetLoops",["b36"],[],["l37","l38","l39","l40","l41","l42"]],["Fuse",["l41","l42"],[1],["l43"]],["SampleCategorical",[],[[1,2,3,4],[0.25,0.25,0.25,0.25]],["v44"]],["Annotate",["b36","v44"],["meta_schedule.cooperative_fetch"],[]],["CacheRead",["b0",["b0"]],[1,"shared"],["b45"]],["ComputeAt",["b45","l29"],[1,-1],[]],["GetLoops",["b45"],[],["l46","l47","l48","l49","l50","l51"]],["Fuse",["l50","l51"],[1],["l52"]],["SampleCategorical",[],[[1,2,3,4],[0.25,0.25,0.25,0.25]],["v53"]],["Annotate",["b45","v53"],["meta_schedule.cooperative_fetch"],[]],["Fuse",["l29"],[1],["l54"]],["Annotate",["l54",[0,0,2]],["software_pipeline_stage"],[]],["Annotate",["l54",[0,1,2]],["software_pipeline_order"],[]],["Annotate",["l54",[0]],["software_pipeline_async_stages"],[]],["ReverseComputeInline",["b1"],[],[]],["SampleCategorical",[],[[0,16,64,512,1024],[0.2000000000000000111,0.2000000000000000111,0.2000000000000000111,0.2000000000000000111,0.2000000000000000111]],["v55"]],["Annotate",["b2","v55"],["meta_schedule.unroll_explicit"],[]],["EnterPostproc",[],[],[]],["Unannotate",["b36"],["meta_schedule.cooperative_fetch"],[]],["GetLoops",["b36"],[],["l56","l57","l58","l59","l60"]],["Split",["l60","None",100],[1,0],["l61","l62"]],["Bind",["l62"],["threadIdx.x"],[]],["Unannotate",["b45"],["meta_schedule.cooperative_fetch"],[]],["GetLoops",["b45"],[],["l63","l64","l65","l66","l67"]],["Split",["l67","None",100,2],[1,0],["l68","l69","l70"]],["Vectorize",["l70"],[],[]],["Bind",["l69"],["threadIdx.x"],[]],["GetBlock",[],["root","main"],["b71"]],["Unannotate",["b71"],["meta_schedule.unroll_explicit"],[]],["GetChildBlocks",["b71"],[],["b72","b73","b74","b75"]],["GetLoops",["b72"],[],["l76","l77","l78","l79","l80","l81"]],["GetLoops",["b73"],[],["l82","l83","l84","l85","l86","l87","l88"]],["GetLoops",["b74"],[],["l89","l90","l91","l92","l93","l94","l95","l96","l97","l98"]],["GetLoops",["b75"],[],["l99","l100","l101","l102","l103"]],["GetBlock",[],["matmul","main"],["b104"]],["GetLoops",["b104"],[],["l105","l106","l107","l108","l109","l110","l111","l112","l113","l114"]],["DecomposeReduction",["b104","l108"],[],["b115"]]],[[5,[1,1,1,1,1]],[7,[2,5,100,1,1]],[9,[64,1,8]],[26,0],[32,1],[39,0]]],[4.7404902989449004185e-05],{"arch":"sm_86","keys":["cuda","gpu"],"kind":"cuda","max_num_threads":1024,"max_shared_memory_per_block":49152,"max_threads_per_block":1024,"registers_per_block":65536,"tag":"","thread_warp_size":32},[["TENSOR","float32",[1,512]],["TENSOR","float32",[512,1000]],["TENSOR","float32",[1000]],["TENSOR","float32",[1,1000]]]]]
[0,[[[["GetBlock",[],["matmul","main"],["b0"]],["GetBlock",[],["T_add","main"],["b1"]],["GetBlock",[],["root","main"],["b2"]],["Annotate",["b0","\"SSSRRSRS\""],["meta_schedule.tiling_structure"],[]],["GetLoops",["b0"],[],["l3","l4","l5"]],["SamplePerfectTile",["l3"],[5,64],["v6","v7","v8","v9","v10"]],["Split",["l3","v6","v7","v8","v9","v10"],[1,0],["l11","l12","l13","l14","l15"]],["SamplePerfectTile",["l4"],[5,64],["v16","v17","v18","v19","v20"]],["Split",["l4","v16","v17","v18","v19","v20"],[1,0],["l21","l22","l23","l24","l25"]],["SamplePerfectTile",["l5"],[3,64],["v26","v27","v28"]],["Split",["l5","v26","v27","v28"],[1,0],["l29","l30","l31"]],["Reorder",["l11","l21","l12","l22","l13","l23","l29","l30","l14","l24","l31","l15","l25"],[],[]],["Fuse",["l11","l21"],[1],["l32"]],["Bind",["l32"],["blockIdx.x"],[]],["Fuse",["l12","l22"],[1],["l33"]],["Bind",["l33"],["vthread.x"],[]],["Fuse",["l13","l23"],[1],["l34"]],["Bind",["l34"],["threadIdx.x"],[]],["Annotate",["b0",32],["meta_schedule.thread_extent_low_inclusive"],[]],["Annotate",["b0",1024],["meta_schedule.thread_extent_high_inclusive"],[]],["CacheWrite",["b0",[]],[0,"local"],["b35"]],["ReverseComputeAt",["b35","l34"],[1,-1],[]],["CacheRead",["b0",["b0"]],[0,"shared"],["b36"]],["ComputeAt",["b36","l29"],[1,-1],[]],["GetLoops",["b36"],[],["l37","l38","l39","l40","l41","l42"]],["Fuse",["l41","l42"],[1],["l43"]],["SampleCategorical",[],[[1,2,3,4],[0.25,0.25,0.25,0.25]],["v44"]],["Annotate",["b36","v44"],["meta_schedule.cooperative_fetch"],[]],["CacheRead",["b0",["b0"]],[1,"shared"],["b45"]],["ComputeAt",["b45","l29"],[1,-1],[]],["GetLoops",["b45"],[],["l46","l47","l48","l49","l50","l51"]],["Fuse",["l50","l51"],[1],["l52"]],["SampleCategorical",[],[[1,2,3,4],[0.25,0.25,0.25,0.25]],["v53"]],["Annotate",["b45","v53"],["meta_schedule.cooperative_fetch"],[]],["ReverseComputeInline",["b1"],[],[]],["SampleCategorical",[],[[0,16,64,512,1024],[0.2000000000000000111,0.2000000000000000111,0.2000000000000000111,0.2000000000000000111,0.2000000000000000111]],["v54"]],["Annotate",["b2","v54"],["meta_schedule.unroll_explicit"],[]],["EnterPostproc",[],[],[]],["Unannotate",["b36"],["meta_schedule.cooperative_fetch"],[]],["GetLoops",["b36"],[],["l55","l56","l57","l58","l59"]],["Split",["l59","None",50],[1,0],["l60","l61"]],["Bind",["l61"],["threadIdx.x"],[]],["Unannotate",["b45"],["meta_schedule.cooperative_fetch"],[]],["GetLoops",["b45"],[],["l62","l63","l64","l65","l66"]],["Split",["l66","None",50],[1,0],["l67","l68"]],["Bind",["l68"],["threadIdx.x"],[]],["GetBlock",[],["root","main"],["b69"]],["Unannotate",["b69"],["meta_schedule.unroll_explicit"],[]],["GetChildBlocks",["b69"],[],["b70","b71","b72","b73"]],["GetLoops",["b70"],[],["l74","l75","l76","l77","l78","l79"]],["GetLoops",["b71"],[],["l80","l81","l82","l83","l84","l85"]],["GetLoops",["b72"],[],["l86","l87","l88","l89","l90","l91","l92","l93","l94","l95"]],["Annotate",["l86",512],["pragma_auto_unroll_max_step"],[]],["Annotate",["l86",1],["pragma_unroll_explicit"],[]],["GetLoops",["b73"],[],["l96","l97","l98","l99","l100"]],["GetBlock",[],["matmul","main"],["b101"]],["GetLoops",["b101"],[],["l102","l103","l104","l105","l106","l107","l108","l109","l110","l111"]],["DecomposeReduction",["b101","l105"],[],["b112"]]],[[5,[1,1,1,1,1]],[7,[1,1,50,20,1]],[9,[64,8,1]],[26,0],[32,2],[35,3]]],[8.3819039068994179316e-05],{"arch":"sm_86","keys":["cuda","gpu"],"kind":"cuda","max_num_threads":1024,"max_shared_memory_per_block":49152,"max_threads_per_block":1024,"registers_per_block":65536,"tag":"","thread_warp_size":32},[["TENSOR","float32",[1,512]],["TENSOR","float32",[512,1000]],["TENSOR","float32",[1000]],["TENSOR","float32",[1,1000]]]]]
[0,[[[["GetBlock",[],["matmul","main"],["b0"]],["GetBlock",[],["T_add","main"],["b1"]],["GetBlock",[],["root","main"],["b2"]],["Annotate",["b0","\"SSSRRSRS\""],["meta_schedule.tiling_structure"],[]],["GetLoops",["b0"],[],["l3","l4","l5"]],["SamplePerfectTile",["l3"],[5,64],["v6","v7","v8","v9","v10"]],["Split",["l3","v6","v7","v8","v9","v10"],[1,0],["l11","l12","l13","l14","l15"]],["SamplePerfectTile",["l4"],[5,64],["v16","v17","v18","v19","v20"]],["Split",["l4","v16","v17","v18","v19","v20"],[1,0],["l21","l22","l23","l24","l25"]],["SamplePerfectTile",["l5"],[3,64],["v26","v27","v28"]],["Split",["l5","v26","v27","v28"],[1,0],["l29","l30","l31"]],["Reorder",["l11","l21","l12","l22","l13","l23","l29","l30","l14","l24","l31","l15","l25"],[],[]],["Fuse",["l11","l21"],[1],["l32"]],["Bind",["l32"],["blockIdx.x"],[]],["Fuse",["l12","l22"],[1],["l33"]],["Bind",["l33"],["vthread.x"],[]],["Fuse",["l13","l23"],[1],["l34"]],["Bind",["l34"],["threadIdx.x"],[]],["Annotate",["b0",32],["meta_schedule.thread_extent_low_inclusive"],[]],["Annotate",["b0",1024],["meta_schedule.thread_extent_high_inclusive"],[]],["CacheWrite",["b0",[]],[0,"local"],["b35"]],["ReverseComputeAt",["b35","l34"],[1,-1],[]],["CacheRead",["b0",["b0"]],[0,"shared"],["b36"]],["ComputeAt",["b36","l29"],[1,-1],[]],["GetLoops",["b36"],[],["l37","l38","l39","l40","l41","l42"]],["Fuse",["l41","l42"],[1],["l43"]],["SampleCategorical",[],[[1,2,3,4],[0.25,0.25,0.25,0.25]],["v44"]],["Annotate",["b36","v44"],["meta_schedule.cooperative_fetch"],[]],["CacheRead",["b0",["b0"]],[1,"shared"],["b45"]],["ComputeAt",["b45","l29"],[1,-1],[]],["GetLoops",["b45"],[],["l46","l47","l48","l49","l50","l51"]],["Fuse",["l50","l51"],[1],["l52"]],["SampleCategorical",[],[[1,2,3,4],[0.25,0.25,0.25,0.25]],["v53"]],["Annotate",["b45","v53"],["meta_schedule.cooperative_fetch"],[]],["ReverseComputeInline",["b1"],[],[]],["SampleCategorical",[],[[0,16,64,512,1024],[0.2000000000000000111,0.2000000000000000111,0.2000000000000000111,0.2000000000000000111,0.2000000000000000111]],["v54"]],["Annotate",["b2","v54"],["meta_schedule.unroll_explicit"],[]],["EnterPostproc",[],[],[]],["Unannotate",["b36"],["meta_schedule.cooperative_fetch"],[]],["GetLoops",["b36"],[],["l55","l56","l57","l58","l59"]],["Split",["l59","None",125],[1,0],["l60","l61"]],["Bind",["l61"],["threadIdx.x"],[]],["Unannotate",["b45"],["meta_schedule.cooperative_fetch"],[]],["GetLoops",["b45"],[],["l62","l63","l64","l65","l66"]],["Split",["l66","None",125,2],[1,0],["l67","l68","l69"]],["Vectorize",["l69"],[],[]],["Bind",["l68"],["threadIdx.x"],[]],["GetBlock",[],["root","main"],["b70"]],["Unannotate",["b70"],["meta_schedule.unroll_explicit"],[]],["GetChildBlocks",["b70"],[],["b71","b72","b73","b74"]],["GetLoops",["b71"],[],["l75","l76","l77","l78","l79","l80"]],["GetLoops",["b72"],[],["l81","l82","l83","l84","l85","l86","l87"]],["GetLoops",["b73"],[],["l88","l89","l90","l91","l92","l93","l94","l95","l96","l97"]],["Annotate",["l88",16],["pragma_auto_unroll_max_step"],[]],["Annotate",["l88",1],["pragma_unroll_explicit"],[]],["GetLoops",["b74"],[],["l98","l99","l100","l101","l102"]],["GetBlock",[],["matmul","main"],["b103"]],["GetLoops",["b103"],[],["l104","l105","l106","l107","l108","l109","l110","l111","l112","l113"]],["DecomposeReduction",["b103","l107"],[],["b114"]]],[[5,[1,1,1,1,1]],[7,[2,2,125,2,1]],[9,[32,1,16]],[26,0],[32,1],[35,1]]],[3.4338548838209982314e-05],{"arch":"sm_86","keys":["cuda","gpu"],"kind":"cuda","max_num_threads":1024,"max_shared_memory_per_block":49152,"max_threads_per_block":1024,"registers_per_block":65536,"tag":"","thread_warp_size":32},[["TENSOR","float32",[1,512]],["TENSOR","float32",[512,1000]],["TENSOR","float32",[1000]],["TENSOR","float32",[1,1000]]]]]
